{
  "meta": {
    "version": "3.2.0",
    "actualizado": "2026-09-22",
    "reglas": [
      "Este archivo es la ÚNICA fuente de verdad. Web, PDF, README y asistente IA se generan o leen desde aquí.",
      "Ninguna IA puede agregar datos que no estén aquí. Si falta algo, se agrega primero en este archivo y lo valida Victor.",
      "evidencia: produccion = hecho en un empleo real | laboratorio = entorno controlado/académico | formacion = solo estudiado.",
      "Las afirmaciones listadas en 'prohibido' nunca deben aparecer en ninguna salida.",
      "Este archivo es público. El material editorial y los proyectos privados viven en _privado/notas.json."
    ]
  },
  "identidad": {
    "nombre": "Victor R. López",
    "nombre_completo": "Victor Rafael López",
    "titular": "Responsable de TI | Infraestructura, Virtualización y Redes | Ciberseguridad",
    "titular_largo": "Responsable de TI en Kaitai Nicaragua | Infraestructura, Virtualización y Redes | Ciberseguridad | Estudiante de Ing. en Telemática (UNAN)",
    "ubicacion": "Ciudad Sandino, Managua, Nicaragua",
    "email": "victorlpz3293@gmail.com",
    "telefono": "+505 8133-6115",
    "web": "https://www.victorlpz3293.me",
    "linkedin": "https://www.linkedin.com/in/victorlpz3293/",
    "github": "https://github.com/victorlpz3293",
    "idiomas": [
      {
        "idioma": "Español",
        "nivel": "Nativo"
      },
      {
        "idioma": "Inglés",
        "nivel": "Básico–intermedio (lectura técnica)"
      }
    ],
    "disponibilidad": "Presencial o híbrido en Managua; abierto a remoto"
  },
  "resumen": {
    "corto": "Responsable de TI con más de 7 años de experiencia en soporte, infraestructura y redes corporativas. Estudiante de Ingeniería en Telemática (UNAN, 4to año).",
    "origen": "Empecé en la tecnología con un técnico medio en computación y desde 2017 trabajo en TI. Pasé del soporte técnico en servicios de outsourcing a liderar el área de TI de una empresa.",
    "largo": "Responsable de TI con más de 7 años de experiencia en soporte, infraestructura y redes corporativas. He consolidado servidores físicos en plataformas virtualizadas, segmentado redes corporativas y administrado servicios de directorio, telefonía IP, almacenamiento y respaldos. Hoy lidero el área de TI de Kaitai Nicaragua, donde implementé la seguridad perimetral, la plataforma de virtualización y la autenticación centralizada de los usuarios. Estudiante de 4to año de Ingeniería en Telemática en la UNAN. Bajo la marca NITSC desarrollo proyectos propios de software con asistencia de IA."
  },
  "objetivo": {
    "puestos": [
      "Jefe / Responsable de TI",
      "Administrador de Sistemas (SysAdmin)",
      "Especialista en Infraestructura TI"
    ],
    "diferenciadores": [
      "Redes y seguridad perimetral (FortiGate, VLANs)",
      "Desarrollo y despliegue de soluciones internas asistido por IA"
    ]
  },
  "experiencia": [
    {
      "id": "kaitai",
      "empresa": "Kaitai Nicaragua S.A.",
      "cargo": "Responsable de TI",
      "ubicacion": "Managua",
      "desde": "2025-09",
      "hasta": null,
      "logros": [
        {
          "texto": "Lidero el área de TI: planificación del presupuesto, gestión de proveedores tecnológicos y mantenimiento preventivo y correctivo de la infraestructura.",
          "evidencia": "produccion"
        },
        {
          "texto": "Implementé y administro la seguridad perimetral de la red corporativa.",
          "evidencia": "produccion"
        },
        {
          "texto": "Implementé la plataforma de virtualización y los servicios de directorio de la empresa.",
          "evidencia": "produccion"
        },
        {
          "texto": "Centralicé la autenticación de los usuarios mediante inicio de sesión único (SSO).",
          "evidencia": "produccion"
        }
      ]
    },
    {
      "id": "megacom",
      "empresa": "Mega Comunicaciones S.A. (MEGACOM)",
      "cargo": "Oficial de TI",
      "ubicacion": "Managua",
      "desde": "2022-10",
      "hasta": "2025-06",
      "logros": [
        {
          "texto": "Administré la infraestructura de TI de la empresa: servidores, red, telefonía IP, respaldos y seguridad perimetral.",
          "evidencia": "produccion"
        },
        {
          "texto": "Lideré un proyecto de modernización que consolidó los servidores físicos en una plataforma virtualizada.",
          "evidencia": "produccion"
        },
        {
          "texto": "Planifiqué y ejecuté migraciones de servicios críticos a entornos virtuales, con ventanas de mantenimiento planificadas y mínimo impacto en la operación.",
          "evidencia": "produccion"
        },
        {
          "texto": "Implementé segmentación de red, almacenamiento centralizado con respaldo externo y la migración de la plataforma de telefonía IP.",
          "evidencia": "produccion"
        },
        {
          "texto": "Di soporte a la infraestructura de TI que sostiene los servicios de radiocomunicación de la empresa.",
          "evidencia": "produccion"
        }
      ]
    },
    {
      "id": "hermoso-vigil",
      "empresa": "Hermoso y Vigil S.A.",
      "cargo": "Ejecutivo de Servicio Técnico",
      "ubicacion": "Managua",
      "desde": "2020-12",
      "hasta": "2022-10",
      "logros": [
        {
          "texto": "Instalé, configuré y di mantenimiento a equipos multifuncionales de impresión en red, y capacité a los usuarios.",
          "evidencia": "produccion"
        },
        {
          "texto": "Implementé soluciones de control de costos de impresión para clientes corporativos.",
          "evidencia": "produccion"
        },
        {
          "texto": "Brindé soporte técnico remoto y presencial.",
          "evidencia": "produccion"
        }
      ]
    },
    {
      "id": "ipesa",
      "empresa": "IPESA de Nicaragua",
      "cargo": "Técnico de Soporte TI",
      "ubicacion": "Managua",
      "desde": "2017-05",
      "hasta": "2019-01",
      "logros": [
        {
          "texto": "Brindé servicios de soporte de TI a clientes corporativos en modalidad de outsourcing.",
          "evidencia": "produccion"
        },
        {
          "texto": "Instalé y mantuve servidores empresariales virtualizados, incluida la configuración de almacenamiento RAID y la actualización de firmware.",
          "evidencia": "produccion"
        },
        {
          "texto": "Di mantenimiento preventivo y correctivo a servidores, equipos de cómputo y de red.",
          "evidencia": "produccion"
        }
      ]
    }
  ],
  "educacion": [
    {
      "institucion": "Universidad Nacional Autónoma de Nicaragua (UNAN-Managua)",
      "titulo": "Ingeniería en Telemática",
      "estado": "En curso — 4to año",
      "desde": "2023-01",
      "hasta_previsto": "2027-01"
    },
    {
      "institucion": "Megabyte Service S.A.",
      "titulo": "Técnico Medio en Computación y Diseño Gráfico",
      "estado": "Completado",
      "desde": "2012",
      "hasta": "2014"
    }
  ],
  "formacion": [
    {
      "nombre": "ISO/IEC 27001:2022 Information Security Associate",
      "institucion": "SkillFront",
      "tipo": "certificacion_examen_online",
      "fecha": "2026-06",
      "id_credencial": "78448473010803",
      "destacar": true,
      "acreditacion": "evaluacion"
    },
    {
      "nombre": "CCNA: Introducción a Redes (ITN)",
      "institucion": "Cisco Networking Academy — EDUTEK",
      "tipo": "curso",
      "fecha": "2026-04",
      "destacar": true,
      "acreditacion": "evaluacion"
    },
    {
      "nombre": "Power BI",
      "institucion": "Instituto Europeo de Posgrado",
      "tipo": "curso",
      "fecha": "2026-03",
      "horas": 50,
      "destacar": false,
      "acreditacion": "evaluacion"
    },
    {
      "nombre": "Bootcamp Fundamentos de Ciberseguridad",
      "institucion": "Comunidad DOJO y WoSec Panamá",
      "tipo": "bootcamp",
      "fecha": "2026-03",
      "horas": 22,
      "destacar": true,
      "acreditacion": "evaluacion"
    },
    {
      "nombre": "Conceptos Básicos de Hardware",
      "institucion": "Cisco Networking Academy — EDUTEK",
      "tipo": "curso_corto",
      "fecha": "2025-02",
      "destacar": false,
      "acreditacion": "asistencia"
    },
    {
      "nombre": "Certificado Profesional de Soporte de TI de Google (5 cursos)",
      "institucion": "Google / Coursera",
      "tipo": "certificado_profesional",
      "fecha": "2024-12",
      "id_credencial": "FBLB0R0RKKAY",
      "vence": false,
      "destacar": true,
      "acreditacion": "evaluacion"
    },
    {
      "nombre": "CCNAv7: Introducción a Redes (ITN)",
      "institucion": "Cisco Networking Academy — Universidad Miguel Hernández (España)",
      "tipo": "curso",
      "fecha": "2023-12",
      "destacar": true,
      "acreditacion": "evaluacion"
    },
    {
      "nombre": "Bootcamp Analista SOC Nivel 1",
      "institucion": "Comunidad DOJO y WoSec Panamá",
      "tipo": "bootcamp",
      "fecha": "2022-09",
      "horas": 24,
      "destacar": true,
      "acreditacion": "evaluacion"
    },
    {
      "nombre": "Análisis Forense Digital en Sistemas Windows",
      "institucion": "UCAPEM Group (Ecuador)",
      "tipo": "curso",
      "fecha": "2022-08",
      "horas": 60,
      "destacar": true,
      "acreditacion": "evaluacion"
    },
    {
      "nombre": "Securitización de Equipos con las Bases de CIS Control",
      "institucion": "Capacitación USACH (Cybersecurity Week)",
      "tipo": "taller",
      "fecha": "2022-06",
      "horas": 1,
      "verificacion": "Credly",
      "destacar": false,
      "acreditacion": "asistencia"
    },
    {
      "nombre": "ISEC Infosecurity Managua",
      "institucion": "I-SEC Information Security",
      "tipo": "evento",
      "fecha": "2022-06",
      "horas": 8,
      "destacar": false,
      "acreditacion": "asistencia"
    },
    {
      "nombre": "Introduction to Packet Tracer",